{
  "fixtureVersion": 1,
  "name": "p256-device-bound-redemption",
  "testOnly": {
    "proofPrivateKey": "AAAAAAAAAAAAAAAAAAAAAAAAAAAAAAAAAAAAAAAAAAE",
    "wrappingPrivateKey": "AAAAAAAAAAAAAAAAAAAAAAAAAAAAAAAAAAAAAAAAAAI",
    "ephemeralPrivateKey": "AAAAAAAAAAAAAAAAAAAAAAAAAAAAAAAAAAAAAAAAAAM",
    "salt": "ERERERERERERERERERERERERERERERERERERERERERE",
    "iv": "IiIiIiIiIiIiIiIi"
  },
  "bootstrap": {
    "bootstrapId": "jbt_11111111111111111111111111111111",
    "deviceId": "mac-finance-01",
    "bearerSha256": "1caa3aac121ae7fd12131b168f8791ede05bd3abcc3ecd19ef8b1c044c86ada1",
    "issuedAt": "2026-07-24T09:29:00Z",
    "expiresAt": "2026-07-24T09:44:00Z"
  },
  "claimPayload": {
    "schemaVersion": 1,
    "kind": "jazz-device-enrollment-claim",
    "bootstrapId": "jbt_11111111111111111111111111111111",
    "claimId": "jcl_22222222222222222222222222222222",
    "deviceId": "mac-finance-01",
    "issuedAt": "2026-07-24T09:30:00Z",
    "expiresAt": "2026-07-24T09:35:00Z",
    "proofKey": {
      "kty": "EC",
      "crv": "P-256",
      "format": "X9.63",
      "alg": "ES256",
      "use": "sig",
      "publicKey": "BGsX0fLhLEJH-Lzm5WOkQPJ3A32BLeszoPShOUXYmMKWT-NC4v4af5uO5-tKfA-eFivOM1drMV7Oy7ZAaDe_UfU"
    },
    "wrappingKey": {
      "kty": "EC",
      "crv": "P-256",
      "format": "X9.63",
      "alg": "ECDH-ES",
      "use": "enc",
      "publicKey": "BHzyexiNA09-ilI4AwS1GsPAiWnid_IbNaYLSPxHZpl4B3dVENuO0EApPZrGn3Qw27p9reY86YIpngS3nSJ4c9E"
    }
  },
  "claimEnvelope": {
    "payload": "eyJib290c3RyYXBJZCI6ImpidF8xMTExMTExMTExMTExMTExMTExMTExMTExMTExMTExMSIsImNsYWltSWQiOiJqY2xfMjIyMjIyMjIyMjIyMjIyMjIyMjIyMjIyMjIyMjIyMjIiLCJkZXZpY2VJZCI6Im1hYy1maW5hbmNlLTAxIiwiZXhwaXJlc0F0IjoiMjAyNi0wNy0yNFQwOTozNTowMFoiLCJpc3N1ZWRBdCI6IjIwMjYtMDctMjRUMDk6MzA6MDBaIiwia2luZCI6ImphenotZGV2aWNlLWVucm9sbG1lbnQtY2xhaW0iLCJwcm9vZktleSI6eyJhbGciOiJFUzI1NiIsImNydiI6IlAtMjU2IiwiZm9ybWF0IjoiWDkuNjMiLCJrdHkiOiJFQyIsInB1YmxpY0tleSI6IkJHc1gwZkxoTEVKSC1Mem01V09rUVBKM0EzMkJMZXN6b1BTaE9VWFltTUtXVC1OQzR2NGFmNXVPNS10S2ZBLWVGaXZPTTFkck1WN095N1pBYURlX1VmVSIsInVzZSI6InNpZyJ9LCJzY2hlbWFWZXJzaW9uIjoxLCJ3cmFwcGluZ0tleSI6eyJhbGciOiJFQ0RILUVTIiwiY3J2IjoiUC0yNTYiLCJmb3JtYXQiOiJYOS42MyIsImt0eSI6IkVDIiwicHVibGljS2V5IjoiQkh6eWV4aU5BMDktaWxJNEF3UzFHc1BBaVduaWRfSWJOYVlMU1B4SFpwbDRCM2RWRU51TzBFQXBQWnJHbjNRdzI3cDlyZVk4NllJcG5nUzNuU0o0YzlFIiwidXNlIjoiZW5jIn19",
    "proof": "1XY7MP7MrTyZ3eWRiq_3aclAEl113iRXPDFn_qJLrOocGRx7cU46rwanVtLJIshh1Ln4Da758mqQJbvJv17k8w"
  },
  "signedDeviceBundle": "eyJwYXlsb2FkIjoiZXlKaGNtTm9hWFpsU1c1blpYTjBWVkpNSWpvaWFIUjBjSE02THk5cVlYcDZMbVY0WVcxd2JHVXVkR1Z6ZEM5aGNHa3ZZWEpqYUdsMlpTMXBibWRsYzNSeklpd2lZWEpsWVVsa0lqb2labWx1WVc1alpTSXNJbUYxWkdsbGJtTmxJam9pYW1GNmVpMWtaWE5yZEc5d0xXTnNhV1Z1ZENJc0ltSjFibVJzWlVWNGNHbHlaWE5CZENJNklqSXdNall0TURjdE1qUlVNRGs2TkRVNk1EQmFJaXdpWW5WdVpHeGxTV1FpT2lKcVpHSmZNREU0Wm1ZellUSTJOemxoTjJKa01UaGhOV1UyWXpOa05HSXlZVEU1TURnaUxDSmpiMjF3WVc1NVNXUWlPaUpoWTIxbElpd2lZMjl0Y0c5dVpXNTBRV05qWlhOeklqcGJYU3dpWkdWMmFXTmxTV1FpT2lKdFlXTXRabWx1WVc1alpTMHdNU0lzSW1WNGNHbHlaWE5CZENJNklqSXdNall0TURndE1qTlVNRGs2TXpBNk1EQmFJaXdpWjJWdVpYSmhkR2x2YmlJNk55d2lhWE56ZFdWa1FYUWlPaUl5TURJMkxUQTNMVEkwVkRBNU9qTXdPakF3V2lJc0ltbHpjM1ZsY2lJNkltaDBkSEJ6T2k4dmFtRjZlaTVsZUdGdGNHeGxMblJsYzNRaUxDSnJhVzVrSWpvaWFtRjZlaTFrWlhacFkyVXRZblZ1Wkd4bElpd2ljSEp2YW1WamRFbGtJam9pT0RZeU5TSXNJbk5qYUdWdFlWWmxjbk5wYjI0aU9qSXNJbk5wYm10Q2RXTnJaWFJKWkNJNkltbHVMbU10YjNSc2NDMXpjbU10YldGakxXWnBibUZ1WTJVdE1ERWlMQ0p6ZEdGamExVlNUQ0k2SW1oMGRIQnpPaTh2WTI5dWJtVmpkR2x2Ymk1clpXSnZiMnhoTG1OdmJTSXNJbk4wY21WaGJVVnVaSEJ2YVc1MElqb2lhSFIwY0hNNkx5OXpkSEpsWVcwdVpYaGhiWEJzWlM1MFpYTjBMM052ZFhKalpTOVVSVk5VTFU5T1RGa3RVMFZEVWtWVUlpd2ljM1J5WldGdFUyOTFjbU5sU1dRaU9pSnpjbU10YldGakxXWnBibUZ1WTJVdE1ERWlMQ0owYjJ0bGJpSTZJamcyTWpVdE1USXpORFUyTFZSRlUxUXRSRVZXU1VORkxWUlBTMFZPTFU1UFZDMUJMVk5GUTFKRlZDSXNJblJ2YTJWdVFuVmphMlYwVTJOdmNHVWlPaUp6YVc1cklpd2lkRzlyWlc1SlpDSTZJakV5TXpRMU5pSjkiLCJwcm90ZWN0ZWQiOiJleUpoYkdjaU9pSkZaRVJUUVNJc0ltdHBaQ0k2SW5SbGMzUXRNakF5Tmkwd055MXlabU00TURNeUxURWlMQ0owZVhBaU9pSmhjSEJzYVdOaGRHbHZiaTlxWVhwNkxXUmxkbWxqWlMxaWRXNWtiR1VyYW5kekluMCIsInNpZ25hdHVyZSI6ImliUU14clJlWUpyTThheFJhQ0JoT29NaWZVSmZLczVGaUZORTFxVUNBVTdaWkVaaUEwdk0wdUpmNkpCM3ZlQUN5aXNncVpzZjBKTjJJb2s0elJPU0NBIn0",
  "sealedBundle": {
    "ciphertext": "lP-BCiscSRKvb4c-hmuVG52MRhNbYq7P6vIGRuDNVMK3fnckIN2z2uKimrSvhQeXMrLrYn1oV40fvGTgJ_G9NJ8dAPhRxS8WG7Kc_xCQ6P7keActWUBiZzpQieA-ZFVxNbVjhUkasHNr5vdinNGpEy3lV8eP3kTDk8H6b3KajaA8k4EJXLIRuVBi4CSTkQen_t_CiGC4TKRWDBthxsz7tG08ejc1qvnw2xpeQmi5N1AqvVKEVzO2gRiT46kyZPdlhfLJb26VpTJ4CAnzKJXxEFTdUfkj5vxEOA_9Q1DTLV0dOyXOtmuXLAcc32L28kspMjvmiNqo8k1ZbsllMrgq6aMR5GoHVSaeI-YNdcaiDCGyUnpsp_mIUnglzQ_W0ift0rrdnNsKPiyRTfKKk3_yOvlPd0zSMU19vnMZ6Tv47KHQTNDH1zhj69qX4BgGI_nt7Uvurgu1fjmOtHsrJaXf0Mps0lX0yhZXy9iblywJBTWFL7BPtPDgSt81SgmN3KlXXwl2zzr6VWFFLltgXMPuQqwRsoiE6asi5qLStb50xJ9uUkCA3NmeOnpwnfjdgUVdsAaM4woZ5trnFi2Pt4oL0mnWDEnFGKPwcQGIbTo4i5-kHYAJu1bXPGcinyCqVJpGJwBLUfMy-XgcXmFHYr4P5Sm6nXQvsdsq_xCb8hcq6ezok0L17-PhS5OkoLeXvYINrLViXR83qKsWAVaxDi6Yqc-ZoEVCs_98bvqdVHug-rmfGzdgVipLi-aALiNRiNmYqcuL8hmhcBnZt2ax098mV8EOOyU64-tny7m3lU_Wxuu2ThsaIPWfiyI3HJSpvYU0eCmKqP94GAATuyS1u2JniNaZV1o3LthEUwTEsT_4Xqz7q6hY2vYGvA0TRNfoiRBHnzCILAL025_WQGxGDPVAyK2VFNUm93NoIzR3-5MFtNAVMdqeCLISaIFnPLRujU0hpB-7fTQgoTzJAwrdQ5JNOkJjLxEngm6ZpwwzT_8RUJOVC1t6CACWyzG6MSfzAeoGTs8ajCTHqmyfSvQD69Gyf5INRnbb1m3vnmKkJfsAXwATK_JAg_ajFdhh9TXig8fGr4HB7fXMqEmH1M91ukW1Q0aiQwoGpypH_UTkzzceoa-MF-Bp53guTfKd0mgw4WrEJ6FN8KTmsY9TUidF899dwROkQJz3iKhfjxZDhHyX5K8njuyLmMuDR3LAQQgkl9NCWsjP0p7cA9SBoGzq5FOKJAWhv9SVo_21_LItJRWAr8CSkAPYcalk1p77yItwYrGlP15qBgm51lqip-amyPctz3T3a_T0V8BM_f7Ni-DxvaF-E5IzciZ7xl1cKSym6IPv5AyttMx2wuvbc7sAieGkB1Gu9OPFpaL3IH0xT45aO9BqtSy-q0YAAE1JRuXYz8LnR59wn3XU2i-QtQI78QRWIV5ia938psrhcYVd63XdJnnqw0jLYXwe4YgFtpAxDdAspezngYVZv89J0NuciqFyhDyJzhrucuVsKP6p6ixglSKSrzQXCqaP_qqPlhryTK_ykOPUnakHL2Wc4-iBu6Do4GBjJYxO1p1hqdbYSj1-UACNZwkjoU3vnW6McnvwOGifavE076JtF0iR8nJawe6_eFeadobplmFNCl2lfWGjyEgz6DZFckzylR0tQPmSIlkfzbb6m4k-d_Bw3W9q8RB9G_8",
    "iv": "IiIiIiIiIiIiIiIi",
    "protected": "eyJhbGciOiJFQ0RILUVTIiwiY29udGV4dCI6eyJib290c3RyYXBJZCI6ImpidF8xMTExMTExMTExMTExMTExMTExMTExMTExMTExMTExMSIsImJ1bmRsZUlkIjoiamRiXzAxOGZmM2EyNjc5YTdiZDE4YTVlNmMzZDRiMmExOTA4IiwiYnVuZGxlU2hhMjU2IjoiZWM4MGViMmRmMzViNDU3MDI3ZTU3MDRmZTUyM2U0NWZiYTcyMDBiMTJkZjIzYzY4YTQwMDUyODQyODE5ODVkMiIsImNsYWltSWQiOiJqY2xfMjIyMjIyMjIyMjIyMjIyMjIyMjIyMjIyMjIyMjIyMjIiLCJjbGFpbVNoYTI1NiI6IjFlMGRlMjJhNDRhNDA5OTBkMGYyNjQwNmM0OTQ4MTAzOTkyYTE5N2FmNDMzYjQxNGY2MGU3NjEzZTE0YzExYmEiLCJkZXZpY2VJZCI6Im1hYy1maW5hbmNlLTAxIiwiZ2VuZXJhdGlvbiI6NywicHJvb2ZLZXlUaHVtYnByaW50IjoieHgwQmNBLXdNb2h3OGF0WURKT2U2cGVHTW9ka2xHMndSSEJsWEhNdmwwTSIsInJldmVhbEV4cGlyZXNBdCI6IjIwMjYtMDctMjRUMDk6NDE6MDBaIiwic2VhbGVkQXQiOiIyMDI2LTA3LTI0VDA5OjMxOjAwWiIsIndyYXBwaW5nS2V5VGh1bWJwcmludCI6IkFocUh6YVlYQTVNem1EQ3Jzc2VVc1ZCR0t5ZmhEaHZla3gwVEhqSF94SUUifSwiY3R5IjoiYXBwbGljYXRpb24vamF6ei1kZXZpY2UtYnVuZGxlK2p3cyIsImVuYyI6IkEyNTZHQ00iLCJlcGsiOnsiY3J2IjoiUC0yNTYiLCJmb3JtYXQiOiJYOS42MyIsImt0eSI6IkVDIiwicHVibGljS2V5IjoiQkY3TDVOR21Nd3BFeVBmdmxSMUw4V1hteHJjaDc2MnBoZnRCWmh2RzVfMXNoelJrREVtWV8zNDNTd2JPR21TaTdOZ3FzRFk0VDdnOW1ubXhKNko5VURJIn0sImtkZiI6IkhLREYtU0hBMjU2Iiwic2FsdCI6IkVSRVJFUkVSRVJFUkVSRVJFUkVSRVJFUkVSRVJFUkVSRVJFUkVSRVJFUkUiLCJ0eXAiOiJhcHBsaWNhdGlvbi9qYXp6LWRldmljZS1lbnJvbGxtZW50LXNlYWxlZCtqc29uIn0",
    "tag": "MtoM3jtaT23srHVWC-Yjsg"
  },
  "expected": {
    "claimSha256": "1e0de22a44a40990d0f26406c4948103992a197af433b414f60e7613e14c11ba",
    "proofKeyThumbprint": "xx0BcA-wMohw8atYDJOe6peGModklG2wRHBlXHMvl0M",
    "wrappingKeyThumbprint": "AhqHzaYXA5MzmDCrsseUsVBGKyfhDhvekx0THjH_xIE",
    "bundleSha256": "ec80eb2df35b457027e5704fe523e45fba7200b12df23c68a4005284281985d2",
    "sealedBundleSha256": "da03bcf58748678cd00824c26aa46a225d8c65b7169b94b8a5ac350e24e554b0"
  }
}
